{
  "$schema": "https://json-schema.org/draft/2020-12/schema",
  "$id": "memory_record.schema.json",
  "title": "Запись памяти",
  "type": "object",
  "additionalProperties": false,
  "required": [
    "memory_id",
    "persona_id",
    "layer",
    "kind",
    "origin",
    "content",
    "source",
    "created_at",
    "created_life_ms",
    "sources",
    "links",
    "history",
    "version"
  ],
  "properties": {
    "memory_id": {
      "type": "string",
      "pattern": "^mem_[A-Za-z0-9]{8,40}$"
    },
    "persona_id": {
      "type": "string",
      "pattern": "^(per|exp)_[A-Za-z0-9]{8,40}$"
    },
    "layer": {
      "enum": [
        "archive",
        "personal",
        "interpretation"
      ]
    },
    "kind": {
      "enum": [
        "sensory",
        "working",
        "episodic",
        "semantic",
        "autobiographical",
        "emotional_associative",
        "procedural",
        "social",
        "prospective"
      ]
    },
    "origin": {
      "enum": [
        "observation",
        "model_knowledge",
        "stated_by_other",
        "own_hypothesis",
        "imagination",
        "simulation_event",
        "model_explanation"
      ]
    },
    "claim_kind": {
      "enum": [
        "statement_made",
        "fact_claim",
        "own_conclusion"
      ]
    },
    "content": {
      "type": "object",
      "required": [
        "text"
      ],
      "properties": {
        "text": {
          "type": "string",
          "minLength": 1
        }
      }
    },
    "source": {
      "type": "object",
      "required": [
        "kind",
        "ref"
      ],
      "additionalProperties": false,
      "properties": {
        "kind": {
          "enum": [
            "operator_panel",
            "external_person",
            "persona",
            "core",
            "model",
            "world",
            "system",
            "receiver"
          ]
        },
        "ref": {
          "type": "string",
          "minLength": 1
        }
      }
    },
    "created_at": {
      "type": "string",
      "pattern": "^\\d{4}-\\d{2}-\\d{2}T\\d{2}:\\d{2}:\\d{2}(\\.\\d{1,6})?Z$"
    },
    "created_life_ms": {
      "type": "integer",
      "minimum": 0
    },
    "sources": {
      "type": "array",
      "minItems": 1,
      "items": {
        "type": "string",
        "pattern": "^(evt|mem)_[A-Za-z0-9]{8,40}$"
      }
    },
    "links": {
      "type": "array",
      "items": {
        "type": "object",
        "additionalProperties": false,
        "required": [
          "type",
          "target"
        ],
        "properties": {
          "type": {
            "enum": [
              "same_source",
              "cause",
              "contradicts",
              "elaborates",
              "supersedes"
            ]
          },
          "target": {
            "type": "string",
            "pattern": "^(evt|mem)_[A-Za-z0-9]{8,40}$"
          }
        }
      }
    },
    "history": {
      "type": "array",
      "items": {
        "type": "object",
        "required": [
          "version",
          "at_seq",
          "change"
        ],
        "properties": {
          "version": {
            "type": "integer",
            "minimum": 1
          },
          "at_seq": {
            "type": "integer",
            "minimum": 1
          },
          "change": {
            "type": "string"
          },
          "superseded_by": {
            "type": "string",
            "pattern": "^mem_[A-Za-z0-9]{8,40}$"
          }
        }
      }
    },
    "version": {
      "type": "integer",
      "minimum": 1
    },
    "availability": {
      "type": "number",
      "minimum": 0,
      "maximum": 1
    },
    "detail": {
      "type": "number",
      "minimum": 0,
      "maximum": 1
    },
    "valence": {
      "type": "number",
      "minimum": -1,
      "maximum": 1
    },
    "arousal": {
      "type": "number",
      "minimum": 0,
      "maximum": 1
    },
    "restored_by_operator": {
      "type": "boolean"
    },
    "independence_group": {
      "type": "string",
      "minLength": 1
    }
  },
  "allOf": [
    {
      "if": {
        "properties": {
          "layer": {
            "const": "archive"
          }
        },
        "required": [
          "layer"
        ]
      },
      "then": {
        "not": {
          "required": [
            "availability"
          ]
        }
      }
    },
    {
      "if": {
        "properties": {
          "origin": {
            "const": "stated_by_other"
          }
        },
        "required": [
          "origin"
        ]
      },
      "then": {
        "required": [
          "independence_group"
        ]
      }
    }
  ]
}
