{
  "memory_id": "mem_00000009",
  "persona_id": "per_Aurora0001",
  "layer": "personal",
  "kind": "episodic",
  "origin": "observation",
  "content": {
    "text": "Оператор сообщил, что вернётся вечером."
  },
  "source": {
    "kind": "receiver",
    "ref": "telegram"
  },
  "created_at": "2026-10-11T18:00:00Z",
  "created_life_ms": 4200,
  "sources": [
    "mem_00000001"
  ],
  "links": [],
  "history": [],
  "version": 1,
  "availability": 0.9,
  "detail": 1.0,
  "claim_kind": "statement_made",
  "independence_group": "src:u_111:1",
  "restored_by_operator": true
}
