{
  "memory_id": "mem_00000002",
  "persona_id": "per_Aurora0001",
  "layer": "interpretation",
  "kind": "semantic",
  "origin": "stated_by_other",
  "content": {
    "text": "Вечером будет дождь."
  },
  "source": {
    "kind": "receiver",
    "ref": "telegram"
  },
  "created_at": "2026-10-11T18:00:00Z",
  "created_life_ms": 4200,
  "sources": [
    "mem_00000001"
  ],
  "links": [
    {
      "type": "elaborates",
      "target": "mem_00000001"
    }
  ],
  "history": [],
  "version": 1,
  "availability": 0.9,
  "detail": 1.0,
  "claim_kind": "fact_claim",
  "independence_group": "src:u_111:1"
}
